<?xml version='1.0' encoding='us-ascii'?>

 

<!DOCTYPE slideshow SYSTEM "slide0.dtd">

<slideshow>
    <slide>     
      <title>Overview</title>
      
      <item>This is xml intro</item>       
      <item>XML is defined by IETF</item>
      <price>2223</price>
    </slide>   
    
    <slide>     
      <title>Intro</title>
      <item>This is java intro</item>       
      <!--<item>XML is defined by IETF</item>-->
       <price>2444</price>
      
    </slide>       
</slideshow>
